"Name","Source","Size","Type","Alignment","AC","HP","Speed","Strength","Dexterity","Constitution","Intelligence","Wisdom","Charisma","Saving Throws","Skills","Damage Vulnerabilities","Damage Resistances","Damage Immunities","Condition Immunities","Senses","Languages","CR","Traits","Actions","Bonus Actions","Reactions"
"Ankylosaurus","MM","Huge","beast","unaligned","15 (natural armor)","68 (8d12 + 16)","30 ft.","19","11","15","2","12","5","","","","","","","passive Perception 11","—","3 (700 XP)",""," Tail. Melee Weapon Attack: +7 to hit, reach 10 ft., one target. Hit: 18 (4d6 + 4) bludgeoning damage. If the target is a creature, it must succeed on a DC 14 Strength saving throw or be knocked prone.","",""
"Basilisk","MM","Medium","monstrosity","unaligned","15 (natural armor)","52 (8d8 + 16)","20 ft.","16","8","15","2","8","7","","","","","","","darkvision 60 ft., passive Perception 9","—","3 (700 XP)"," Petrifying Gaze. If a creature starts its turn within 30 feet of the basilisk and the two of them can see each other, the basilisk can force the creature to make a DC 12 Constitution saving throw if the basilisk isn't incapacitated. On a failed save, the creature magically begins to turn to stone and is restrained. It must repeat the saving throw at the end of its next turn. On a success, the effect ends. On a failure, the creature is petrified until freed by the greater restoration spell or other magic.A creature that isn't surprised can avert its eyes to avoid the saving throw at the start of its turn. If it does so, it can't see the basilisk until the start of its next turn, when it can avert its eyes again. If it looks at the basilisk in the meantime, it must immediately make the save.If the basilisk sees its reflection within 30 feet of it in bright light, it mistakes itself for a rival and targets itself with its gaze."," Bite. Melee Weapon Attack: +5 to hit, reach 5 ft., one target. Hit: 10 (2d6 + 3) piercing damage plus 7 (2d6) poison damage.","",""
"Doppelganger","MM","Medium","monstrosity (shapechanger)","neutral","14","52 (8d8 + 16)","30 ft.","11","18","14","11","12","14","","Deception +6, Insight +3","","","","charmed","darkvision 60 ft., passive Perception 11","Common","3 (700 XP)"," Shapechanger. The doppelganger can use its action to polymorph into a Small or Medium humanoid it has seen, or back into its true form. Its statistics, other than its size, are the same in each form. Any equipment it is wearing or carrying isn't transformed. It reverts to its true form if it dies. Ambusher. In the first round of a combat, the doppelganger has advantage on attack rolls against any creature it surprised. Surprise Attack. If the doppelganger surprises a creature and hits it with an attack during the first round of combat, the target takes an extra 10 (3d6) damage from the attack."," Multiattack. The doppelganger makes two melee attacks. Slam. Melee Weapon Attack: +6 to hit, reach 5 ft., one target. Hit: 7 (1d6 + 4) bludgeoning damage. Read Thoughts. The doppelganger magically reads the surface thoughts of one creature within 60 feet of it. The effect can penetrate barriers, but 3 feet of wood or dirt, 2 feet of stone, 2 inches of metal, or a thin sheet of lead blocks it. While the target is in range, the doppelganger can continue reading its thoughts, as long as the doppelganger's concentration isn't broken (as if concentrating on a spell). While reading the target's mind, the doppelganger has advantage on Wisdom (Insight) and Charisma (Deception, Intimidation, and Persuasion) checks against the target.","",""
"Giant Scorpion","MM","Large","beast","unaligned","15 (natural armor)","52 (7d10 + 14)","40 ft.","15","13","15","1","9","3","","","","","","","blindsight 60 ft., passive Perception 9","—","3 (700 XP)",""," Multiattack. The scorpion makes three attacks: two with its claws and one with its sting. Claw. Melee Weapon Attack: +4 to hit, reach 5 ft., one target. Hit: 6 (1d8 + 2) bludgeoning damage, and the target is grappled (escape DC 12). The scorpion has two claws, each of which can grapple only one target. Sting. Melee Weapon Attack: +4 to hit, reach 5 ft., one creature. Hit: 7 (1d10 + 2) piercing damage, and the target must make a DC 12 Constitution saving throw, taking 22 (4d10) poison damage on a failed save, or half as much damage on a successful one.","",""
"Hell Hound","MM","Medium","fiend","lawful evil","15 (natural armor)","45 (7d8 + 14)","50 ft.","17","12","14","6","13","6","","Perception +5","","","fire","","darkvision 60 ft., passive Perception 15","understands Infernal but can't speak it","3 (700 XP)"," Keen Hearing and Smell. The hound has advantage on Wisdom (Perception) checks that rely on hearing or smell. Pack Tactics. The hound has advantage on an attack roll against a creature if at least one of the hound's allies is within 5 feet of the creature and the ally isn't incapacitated."," Bite. Melee Weapon Attack: +5 to hit, reach 5 ft., one target. Hit: 7 (1d8 + 3) piercing damage plus 7 (2d6) fire damage. Fire Breath (Recharge 5–6). The hound exhales fire in a 15-foot cone. Each creature in that area must make a DC 12 Dexterity saving throw, taking 21 (6d6) fire damage on a failed save, or half as much damage on a successful one.","",""
"Killer Whale","MM","Huge","beast","unaligned","12 (natural armor)","90 (12d12 + 12)","0 ft., swim 60 ft.","19","10","13","3","12","7","","Perception +3","","","","","blindsight 120 ft., passive Perception 13","—","3 (700 XP)"," Echolocation. The whale can't use its blindsight while deafened. Hold Breath. The whale can hold its breath for 30 minutes. Keen Hearing. The whale has advantage on Wisdom (Perception) checks that rely on hearing."," Bite. Melee Weapon Attack: +6 to hit, reach 5 ft., one target. Hit: 21 (5d6 + 4) piercing damage.","",""
"Knight","MM","Medium","humanoid (any race)","any alignment","18 (plate armor)","52 (8d8 + 16)","30 ft.","16","11","14","11","11","15","Con +4, Wis +2","","","","","","passive Perception 10","any one language (usually Common)","3 (700 XP)"," Brave. The knight has advantage on saving throws against being frightened."," Multiattack. The knight makes two melee attacks. Greatsword. Melee Weapon Attack: +5 to hit, reach 5 ft., one target. Hit: 10 (2d6 + 3) slashing damage. Heavy Crossbow. Ranged Weapon Attack: +2 to hit, range 100/400 ft., one target. Hit: 5 (1d10) piercing damage. Leadership (Recharges after a Short or Long Rest). For 1 minute, the knight can utter a special command or warning whenever a nonhostile creature that it can see within 30 feet of it makes an attack roll or a saving throw. The creature can add a d4 to its roll provided it can hear and understand the knight. A creature can benefit from only one Leadership die at a time. This effect ends if the knight is incapacitated.",""," Parry. The knight adds 2 to its AC against one melee attack that would hit it. To do so, the knight must see the attacker and be wielding a melee weapon."
"Manticore","MM","Large","monstrosity","lawful evil","14 (natural armor)","68 (8d10 + 24)","30 ft., fly 50 ft.","17","16","17","7","12","8","","","","","","","darkvision 60 ft., passive Perception 11","Common","3 (700 XP)"," Tail Spike Regrowth. The manticore has twenty-four tail spikes. Used spikes regrow when the manticore finishes a long rest."," Multiattack. The manticore makes three attacks: one with its bite and two with its claws or three with its tail spikes. Bite. Melee Weapon Attack: +5 to hit, reach 5 ft., one target. Hit: 7 (1d8 + 3) piercing damage. Claw. Melee Weapon Attack: +5 to hit, reach 5 ft., one target. Hit: 6 (1d6 + 3) slashing damage. Tail Spike. Ranged Weapon Attack: +5 to hit, range 100/200 ft., one target. Hit: 7 (1d8 + 3) piercing damage.","",""
"Minotaur","MM","Large","monstrosity","chaotic evil","14 (natural armor)","76 (9d10 + 27)","40 ft.","18","11","16","6","16","9","","Perception +7","","","","","darkvision 60 ft., passive Perception 17","Abyssal","3 (700 XP)"," Charge. If the minotaur moves at least 10 feet straight toward a target and then hits it with a gore attack on the same turn, the target takes an extra 9 (2d8) piercing damage. If the target is a creature, it must succeed on a DC 14 Strength saving throw or be pushed up to 10 feet away and knocked prone. Labyrinthine Recall. The minotaur can perfectly recall any path it has traveled. Reckless. At the start of its turn, the minotaur can gain advantage on all melee weapon attack rolls it makes during that turn, but attack rolls against it have advantage until the start of its next turn."," Greataxe. Melee Weapon Attack: +6 to hit, reach 5 ft., one target. Hit: 17 (2d12 + 4) slashing damage. Gore. Melee Weapon Attack: +6 to hit, reach 5 ft., one target. Hit: 13 (2d8 + 4) piercing damage.","",""
"Mummy","MM","Medium","undead","lawful evil","11 (natural armor)","58 (9d8 + 18)","20 ft.","16","8","15","6","10","12","Wis +2","","fire","bludgeoning, piercing, and slashing from nonmagical attacks","necrotic, poison","charmed, exhaustion, frightened, paralyzed, poisoned","darkvision 60 ft., passive Perception 10","the languages it knew in life","3 (700 XP)",""," Multiattack. The mummy can use its Dreadful Glare and makes one attack with its rotting fist. Rotting Fist. Melee Weapon Attack: +5 to hit, reach 5 ft., one target. Hit: 10 (2d6 + 3) bludgeoning damage plus 10 (3d6) necrotic damage. If the target is a creature, it must succeed on a DC 12 Constitution saving throw or be cursed with mummy rot. The cursed target can't regain hit points, and its hit point maximum decreases by 10 (3d6) for every 24 hours that elapse. If the curse reduces the target's hit point maximum to 0, the target dies, and its body turns to dust. The curse lasts until removed by the remove curse spell or other magic. Dreadful Glare. The mummy targets one creature it can see within 60 feet of it. If the target can see the mummy, it must succeed on a DC 11 Wisdom saving throw against this magic or become frightened until the end of the mummy's next turn. If the target fails the saving throw by 5 or more, it is also paralyzed for the same duration. A target that succeeds on the saving throw is immune to the Dreadful Glare of all mummies (but not mummy lords) for the next 24 hours.","",""
"Owlbear","MM","Large","monstrosity","unaligned","13 (natural armor)","59 (7d10 + 21)","40 ft.","20","12","17","3","12","7","","Perception +3","","","","","darkvision 60 ft., passive Perception 13","—","3 (700 XP)"," Keen Sight and Smell. The owlbear has advantage on Wisdom (Perception) checks that rely on sight or smell."," Multiattack. The owlbear makes two attacks: one with its beak and one with its claws. Beak. Melee Weapon Attack: +7 to hit, reach 5 ft., one creature. Hit: 10 (1d10 + 5) piercing damage. Claws. Melee Weapon Attack: +7 to hit, reach 5 ft., one target. Hit: 14 (2d8 + 5) slashing damage.","",""
"Phase Spider","MM","Large","monstrosity","unaligned","13 (natural armor)","32 (5d10 + 5)","30 ft., climb 30 ft.","15","15","12","6","10","6","","Stealth +6","","","","","darkvision 60 ft., passive Perception 10","—","3 (700 XP)"," Ethereal Jaunt. As a bonus action, the spider can magically shift from the Material Plane to the Ethereal Plane, or vice versa. Spider Climb. The spider can climb difficult surfaces, including upside down on ceilings, without needing to make an ability check. Web Walker. The spider ignores movement restrictions caused by webbing."," Bite. Melee Weapon Attack: +4 to hit, reach 5 ft., one creature. Hit: 7 (1d10 + 2) piercing damage, and the target must make a DC 11 Constitution saving throw, taking 18 (4d8) poison damage on a failed save, or half as much damage on a successful one. If the poison damage reduces the target to 0 hit points, the target is stable but poisoned for 1 hour, even after regaining hit points, and is paralyzed while poisoned in this way.","",""
"Spectator","MM","Medium","aberration","lawful neutral","14 (natural armor)","39 (6d8 + 12)","0 ft., fly 30 ft. (hover)","8","14","14","13","14","11","","Perception +6","","","","prone","darkvision 120 ft., passive Perception 16","Deep Speech, Undercommon, telepathy 120 ft.","3 (700 XP)",""," Bite. Melee Weapon Attack: +1 to hit, reach 5 ft., one target. Hit: 2 (1d6 - 1) piercing damage. Eye Rays. The spectator shoots up to two of the following magical eye rays at one or two creatures it can see within 90 feet of it. It can use each ray only once on a turn.1. Confusion Ray. The target must succeed on a DC 13 Wisdom saving throw, or it can't take reactions until the end of its next turn. On its turn, the target can't move, and it uses its action to make a melee or ranged attack against a randomly determined creature within range. If the target can't attack, it does nothing on its turn.2. Paralyzing Ray. The target must succeed on a DC 13 Constitution saving throw or be paralyzed for 1 minute. The target can repeat the saving throw at the end of each of its turns, ending the effect on itself on a success.3. Fear Ray. The target must succeed on a DC 13 Wisdom saving throw or be frightened for 1 minute. The target can repeat the saving throw at the end of each of its turns, with disadvantage if the spectator is visible to the target, ending the effect on itself on a success.4. Wounding Ray. The target must make a DC 13 Constitution saving throw, taking 16 (3d10) necrotic damage on a failed save, or half as much damage on a successful one. Create Food and Water. The spectator magically creates enough food and water to sustain itself for 24 hours.",""," Spell Reflection. If the spectator makes a successful saving throw against a spell, or a spell attack misses it, the spectator can choose another creature (including the spellcaster) it can see within 30 feet of it. The spell targets the chosen creature instead of the spectator. If the spell forced a saving throw, the chosen creature makes its own save. If the spell was an attack, the attack roll is rerolled against the chosen creature."
"Werewolf","MM","Medium","humanoid (human, shapechanger)","chaotic evil","11 in humanoid form, 12 (natural armor) in wolf or hybrid form","58 (9d8 + 18)","30 ft. (40 ft. in wolf form)","15","13","14","10","11","10","","Perception +4","","","bludgeoning, piercing, and slashing from nonmagical attacks that aren't silvered","","passive Perception 14","Common (can't speak in wolf form)","3 (700 XP)"," Shapechanger. The werewolf can use its action to polymorph into a wolf-humanoid hybrid or into a wolf, or back into its true form, which is humanoid. Its statistics, other than its AC, are the same in each form. Any equipment it is wearing or carrying isn't transformed. It reverts to its true form if it dies. Keen Hearing and Smell. The werewolf has advantage on Wisdom (Perception) checks that rely on hearing or smell."," Multiattack (Humanoid or Hybrid Form Only). The werewolf makes two attacks: two with its spear (humanoid form) or one with its bite and one with its claws (hybrid form). Bite (Wolf or Hybrid Form Only). Melee Weapon Attack: +4 to hit, reach 5 ft., one target. Hit: 6 (1d8 + 2) piercing damage. If the target is a humanoid, it must succeed on a DC 12 Constitution saving throw or be cursed with werewolf lycanthropy. Claws (Hybrid Form Only). Melee Weapon Attack: +4 to hit, reach 5 ft., one creature. Hit: 7 (2d4 + 2) slashing damage. Spear (Humanoid Form Only). Melee or Ranged Weapon Attack: +4 to hit, reach 5 ft. or range 20/60 ft., one creature. Hit: 5 (1d6 + 2) piercing damage, or 6 (1d8 + 2) piercing damage if used with two hands to make a melee attack.","",""
"Wight","MM","Medium","undead","neutral evil","14 (studded leather)","45 (6d8 + 18)","30 ft.","15","14","16","10","13","15","","Perception +3, Stealth +4","","necrotic; bludgeoning, piercing, and slashing from nonmagical attacks that aren't silvered","poison","exhaustion, poisoned","darkvision 60 ft., passive Perception 13","the languages it knew in life","3 (700 XP)"," Sunlight Sensitivity. While in sunlight, the wight has disadvantage on attack rolls, as well as on Wisdom (Perception) checks that rely on sight."," Multiattack. The wight makes two longsword attacks or two longbow attacks. It can use its Life Drain in place of one longsword attack. Life Drain. Melee Weapon Attack: +4 to hit, reach 5 ft., one creature. Hit: 5 (1d6 + 2) necrotic damage. The target must succeed on a DC 13 Constitution saving throw or its hit point maximum is reduced by an amount equal to the damage taken. This reduction lasts until the target finishes a long rest. The target dies if this effect reduces its hit point maximum to 0.A humanoid slain by this attack rises 24 hours later as a zombie under the wight's control, unless the humanoid is restored to life or its body is destroyed. The wight can have no more than twelve zombies under its control at one time. Longsword. Melee Weapon Attack: +4 to hit, reach 5 ft., one target. Hit: 6 (1d8 + 2) slashing damage, or 7 (1d10 + 2) slashing damage if used with two hands. Longbow. Ranged Weapon Attack: +4 to hit, range 150/600 ft., one target. Hit: 6 (1d8 + 2) piercing damage.","",""
"Winter Wolf","MM","Large","monstrosity","neutral evil","13 (natural armor)","75 (10d10 + 20)","50 ft.","18","13","14","7","12","8","","Perception +5, Stealth +3","","","cold","","passive Perception 15","Common, Giant, Winter Wolf","3 (700 XP)"," Keen Hearing and Smell. The wolf has advantage on Wisdom (Perception) checks that rely on hearing or smell. Pack Tactics. The wolf has advantage on an attack roll against a creature if at least one of the wolf's allies is within 5 feet of the creature and the ally isn't incapacitated. Snow Camouflage. The wolf has advantage on Dexterity (Stealth) checks made to hide in snowy terrain."," Bite. Melee Weapon Attack: +6 to hit, reach 5 ft., one target. Hit: 11 (2d6 + 4) piercing damage. If the target is a creature, it must succeed on a DC 14 Strength saving throw or be knocked prone. Cold Breath (Recharge 5–6). The wolf exhales a blast of freezing wind in a 15-foot cone. Each creature in that area must make a DC 12 Dexterity saving throw, taking 18 (4d8) cold damage on a failed save, or half as much damage on a successful one.","",""
"Yeti","MM","Large","monstrosity","chaotic evil","12 (natural armor)","51 (6d10 + 18)","40 ft., climb 40 ft.","18","13","16","8","12","7","","Perception +3, Stealth +3","","","cold","","darkvision 60 ft., passive Perception 13","Yeti","3 (700 XP)"," Fear of Fire. If the yeti takes fire damage, it has disadvantage on attack rolls and ability checks until the end of its next turn. Keen Smell. The yeti has advantage on Wisdom (Perception) checks that rely on smell. Snow Camouflage. The yeti has advantage on Dexterity (Stealth) checks made to hide in snowy terrain."," Multiattack. The yeti can use its Chilling Gaze and makes two claw attacks. Claw. Melee Weapon Attack: +6 to hit, reach 5 ft., one target. Hit: 7 (1d6 + 4) slashing damage plus 3 (1d6) cold damage. Chilling Gaze. The yeti targets one creature it can see within 30 feet of it. If the target can see the yeti, the target must succeed on a DC 13 Constitution saving throw against this magic or take 10 (3d6) cold damage and then be paralyzed for 1 minute, unless it is immune to cold damage. The target can repeat the saving throw at the end of each of its turns, ending the effect on itself on a success. If the target's saving throw is successful, or if the effect ends on it, the target is immune to the Chilling Gaze of all yetis (but not abominable yetis) for 1 hour.","",""